choose_one_gold,choose_one,keyword,_last_judgment_at,text,userid,choose_one:confidence,tweetid,_golden,_trusted_judgments,location,_unit_id,_unit_state,objective,link_url1,link_uri1,link_title1,link_url2,link_uri2,link_title2,link_url3,link_uri3,link_title3
,Relevant,emergency%20plan,9/1/2015 16:25,A big issue left undone is HOW to get home if adverse weather hits. @GoTriangle has no real emergency plan in place https://t.co/s7xdXuudcy,259784760,1,6.29E+17,FALSE,5,"Chapel Hill, NC",778249407,finalized,1,https://twitter.com/EmployeeForum/status/629300817586180097,https://twitter.com/,"Employee Forum on Twitter: ""Streeter: @unc_hr looking into revisions of adverse weather policy #forummeeting #UNCstaff""",,,,,,
,Relevant,emergency%20plan,9/1/2015 14:51,Storm prompts activation of City of Calgary's Municipal Emergency Plan: As the City of Calgary remains under a‰_ http://t.co/7jcR8REgUv,68293330,1,6.29E+17,FALSE,5,"Calgary, Alberta",778249408,finalized,1,,,,,,,,,
,Relevant,emergency%20plan,8/27/2015 13:48,City of Calgary activates municipal emergency plan as more thunderstorms approach http://t.co/8iHucO4GLW,2990485153,1,6.29E+17,FALSE,6,,778249409,finalized,1,http://www.rightrelevance.com/search/articles/hero?article=8585c54dee207d67a84c14109ffcb06a6bb04adb&query=calgary%20ab&taccount=calgarryab,http://www.rightrelevance.com/," 
            Right Relevance : Influencers, Articles and Conversations
        ",,,,,,
,Relevant,emergency%20services,9/1/2015 14:51,@TfLBusAlerts @TfLBusAlerts The Drive in Ilford closed both ways while emergency services deal with a call out. Buses are now stuck.,448957126,1,6.29E+17,FALSE,5,London,778249416,finalized,1,,,,,,,,,
,Relevant,emergency%20services,9/2/2015 8:54,Ballina emergency services have again been activated following a shark sighting of what has been described as two... http://t.co/Eu5tKTptpW,3022553851,1,6.29E+17,FALSE,5,"Lismore, New South Wales",778249429,finalized,1,https://www.facebook.com/northcoastcrime/posts/376901632519272,https://www.facebook.com/,‪Facebook‬,,,,,,
,Relevant,emergency%20services,8/31/2015 2:05,Removing tsunami debris from the West Coast: Karen Robinson Enviromental and Emergency services manager of the‰_ http://t.co/1MeEo3WJcO,67898674,1,6.29E+17,FALSE,5,"Vancouver, British Columbia",778249437,finalized,1,,,,,,,,,
,Relevant,emergency%20services,8/29/2015 11:47,#Breaking #News - Call for Tasmania's emergency services to be trained in horse ... - http://t.co/urJwsVr311 http://t.co/7JfrETeIi4,3009839485,1,6.29E+17,FALSE,5,USA,778249441,finalized,1,http://www.kemsat.com/press/?p=605327,http://www.kemsat.com/,,,,,,,
,Relevant,emergency%20services,8/30/2015 21:29,Services are returning to normal #SouthLine after a medical emergency at Yennora and urgent track equipment repairs at Cabramatta earlier.,2238333955,1,6.29E+17,FALSE,5,Sydney,778249458,finalized,1,,,,,,,,,
,Relevant,engulfed,8/27/2015 16:20,Just saw a car on the I-77 Fully engulfed in flames hahah,377096722,1,6.29E+17,FALSE,5,"Fredonia,NY",778249466,finalized,0,,,,,,,,,
,Relevant,engulfed,9/1/2015 18:09,Men escape car engulfed in flames in Parley's Canyon crews investigating cause - http://t.co/P6cyLz5lpt http://t.co/Jpu9gIps9f,601700010,1,6.29E+17,FALSE,5,,778249467,finalized,1,http://fox13now.com,http://fox13now.com/,"fox13now.com | News for Salt Lake City, Ogden, Provo and beyond",http://donatecartocharityvalue.blogspot.co.il/,http://donatecartocharityvalue.blogspot.co.il/,donate car to charity value,,,
,Relevant,engulfed,9/1/2015 17:58,Men escape car engulfed in flames in Parley's Canyon crews investigating cause - http://t.co/CYzlshlQhG http://t.co/nDiS8f1vzt,627529646,1,6.29E+17,FALSE,5,,778249472,finalized,1,http://fox13now.com,http://fox13now.com/,"fox13now.com | News for Salt Lake City, Ogden, Provo and beyond",http://donatecartocharityvalue.blogspot.co.il/,http://donatecartocharityvalue.blogspot.co.il/,donate car to charity value,,,
,Relevant,engulfed,8/28/2015 4:21,#TRAFFICALERT  Eastbound 210 Freeway at Citrus Ave in Azusa. Two motorcycles involved in accident with one fully engulfed in flames in lanes,633112069,1,6.29E+17,FALSE,5,"Glendale, CA",778249474,finalized,1,,,,,,,,,
,Relevant,engulfed,8/28/2015 20:54,Men escape car engulfed in flames in Parley's Canyon crews investigating cause - http://t.co/ldGWsYoWSs http://t.co/cnYVVY4WAT,580773363,1,6.29E+17,FALSE,5,,778249475,finalized,1,http://fox13now.com,http://fox13now.com/,"fox13now.com | News for Salt Lake City, Ogden, Provo and beyond",http://donatecartocharityvalue.blogspot.co.il/,http://donatecartocharityvalue.blogspot.co.il/,donate car to charity value,,,
,Relevant,engulfed,9/1/2015 19:55,Men escape car engulfed in flames in Parley's Canyon crews investigating cause - http://t.co/tFan6qq2Ys http://t.co/rAkwWritPo,577842819,1,6.29E+17,FALSE,5,,778249488,finalized,1,http://fox13now.com,http://fox13now.com/,"fox13now.com | News for Salt Lake City, Ogden, Provo and beyond",http://donatecartocharityvalue.blogspot.co.il/,http://donatecartocharityvalue.blogspot.co.il/,donate car to charity value,,,
,Relevant,engulfed,8/28/2015 11:42,Fully Engulfed Garage Fire: Propane Tanks Inside. Sunnymeade Dr.,2177499732,1,6.29E+17,FALSE,5,"Kokomo, In",778249499,finalized,1,,,,,,,,,
,Relevant,engulfed,9/1/2015 17:59,Men escape car engulfed in flames in Parley's Canyon crews investigating cause - http://t.co/1TVFfba95l http://t.co/ALjwAWkxPj,604150647,1,6.29E+17,FALSE,5,,778249500,finalized,1,http://fox13now.com,http://fox13now.com/,"fox13now.com | News for Salt Lake City, Ogden, Provo and beyond",http://donatecartocharityvalue.blogspot.co.il/,http://donatecartocharityvalue.blogspot.co.il/,donate car to charity value,,,
,Relevant,engulfed,8/27/2015 14:48,Men escape car engulfed in flames in Parley's Canyon crews investigating cause - http://t.co/zevAn9kJzL http://t.co/UUZFs1L5Kt,627658109,1,6.29E+17,FALSE,5,,778249509,finalized,1,http://fox13now.com,http://fox13now.com/,"fox13now.com | News for Salt Lake City, Ogden, Provo and beyond",http://donatecartocharityvalue.blogspot.co.il/,http://donatecartocharityvalue.blogspot.co.il/,donate car to charity value,,,
,Relevant,evacuate,8/29/2015 11:33,Learn how to evacuate your home in the event of a #wildfire view videos at http://t.co/bGeRLjamTE #CA #NV #UT #CO #OR http://t.co/sPuHuvgAsy,1699483212,1,6.29E+17,FALSE,5,Tallahassee Florida,778249530,finalized,1,,,,,,,,,
,Relevant,evacuate,8/27/2015 15:25,California &amp;#039;monster&amp;#039; fire is 20% contained as 13000 are told to evacuate http://t.co/aPTAP6Yx1r,2301398894,1,6.29E+17,FALSE,7,,778249534,finalized,1,http://dragplus.com/post/id/31484959,http://dragplus.com/,,,,,,,
,Relevant,evacuate,9/1/2015 0:08,Firefigthers Evacuate from Northampton Township House Fire http://t.co/hPplD1jHtZ,316734167,1,6.29E+17,FALSE,5,Worldwide,778249537,finalized,1,http://www.phillyfirenews.com/2015/08/05/firefigthers-evacuate-from-northampton-township-house-fire/,http://www.phillyfirenews.com/,,,,,,,
,Relevant,evacuate,8/30/2015 4:36,Fire crews evacuate passengers from a Gold Coast tram trapped when powerlines fell across a carriage. #TenNews 5pm http://t.co/hFyrloQY8q,135371497,1,6.29E+17,FALSE,5,Brisbane,778249540,finalized,1,https://twitter.com/tennewsqld/status/629111797413343232/photo/1,https://twitter.com/,"TEN News Queensland on Twitter: ""Fire crews evacuate passengers from a Gold Coast tram, trapped when powerlines fell across a carriage. #TenNews 5pm http://t.co/hFyrloQY8q""",,,,,,
,Relevant,evacuate,9/1/2015 16:34,ISIS are deploying their troops to other battle grounds since deal with Turkey to evacuate buffer zone areas hence moving fronts to Assad.,3331463668,1,6.29E+17,FALSE,5,Kurdistan ,778249545,finalized,1,,,,,,,,,
,Relevant,evacuate,8/28/2015 3:16,What if the fire up in the Catalinas gets worse and we have to evacuate the area. Aka no school tomorrow,754478490,1,6.29E+17,FALSE,5,foothills,778249550,finalized,1,,,,,,,,,
,Relevant,evacuate,8/29/2015 14:49,The U.S. also flew over each bomb site in World War II with warning letters telling people to evacuate,45016084,1,6.29E+17,FALSE,5,,778249556,finalized,1,,,,,,,,,
,Relevant,evacuate,8/29/2015 10:08,myGC: Broken powerlines evacuate Gold Coast tram suspend services http://t.co/6e7hHfeRz4,2399851435,1,6.29E+17,FALSE,5,"Gold Coast, Qld, Australia",778249557,finalized,1,http://www.mygc.com.au/gold-coast-tram-evacuated-due-to-broken-powerlines/?utm_source=dlvr.it&utm_medium=twitter&utm_campaign=Feed%3A%20myGClocalnews%20%28myGC.com.au%20Local%20News%29,http://www.mygc.com.au/,,,,,,,
,Relevant,evacuate,8/27/2015 15:25,Sooo police dispatch said there was a person threatening to shoot up the Walmart on Rutherford &amp; they had to evacuate,308146545,1,6.29E+17,FALSE,7,,778249559,finalized,1,,,,,,,,,
,Relevant,evacuate,9/1/2015 19:57,my father fucking died when the north tower collapsed ON HIM as he was trying to evacuate more people from the building.,3015835115,1,6.29E+17,FALSE,5,San Diego,778249560,finalized,0,,,,,,,,,
,Relevant,evacuate,8/29/2015 12:02,US govt refuses to evacuate 1000s of Americans from Yemen https://t.co/wQy3JOKuMH #yemen #usa #evacuation #abandoned,379851447,1,6.29E+17,FALSE,5,London UK,778249562,finalized,1,https://www.youtube.com/watch?v=2Sj3pAYMyCA,https://www.youtube.com/,YouTube,,,,,,
,Relevant,evacuate,8/28/2015 20:08,@ahhtheenikki And from what I can tell- they responded to today's gunman quickly and were able to evacuate all the ppl so no one was shot.,1641567428,1,6.29E+17,FALSE,5,Nashville,778249564,finalized,1,,,,,,,,,
,Relevant,evacuate,9/1/2015 16:30,California wildfires force thousands to evacuate: http://t.co/GFsl2Kwt5h via @YouTube,1910519040,1,6.29E+17,FALSE,5,U.S.A,778249566,finalized,1,https://www.youtube.com/watch?v=kjaAfajFKao&feature=youtu.be&a,https://www.youtube.com/,YouTube,,,,,,
,Relevant,razed,8/27/2015 16:13,George Njenga the hero saved his burning friend from a razing wildfire http://t.co/Ywkk26arAG,54509244,1,6.29E+17,FALSE,7,Nairobi-KENYA,778252808,finalized,0,,,,,,,,,
,Relevant,razed,8/29/2015 12:04,The Latest: More Homes Razed by Northern California Wildfire - ABC News http://t.co/bKsYymvIsg #GN,279118291,1,6.29E+17,FALSE,5,,778252811,finalized,1,http://abcnews.go.com/US,http://abcnews.go.com/,"U.S.  News | Latest National News, Videos & Photos - ABC News - ABC News",,,,,,
,Relevant,razed,8/28/2015 11:30,The Latest: More homes razed by Northern California wildfire - SFGate http://t.co/65hunplHYB,1352913667,1,6.29E+17,FALSE,5,,778252812,finalized,1,http://www.sfgate.com/news/us/article/The-Latest-Cooler-weather-aids-California-6426209.php,http://www.sfgate.com/,,,,,,,
,Relevant,razed,8/27/2015 20:16,The Latest: More Homes Razed by Northern California Wildfire - ABC News http://t.co/RlPTtkBG4W,2883867574,1,6.29E+17,FALSE,5,,778252813,finalized,1,http://abcnews.go.com/US,http://abcnews.go.com/,"U.S.  News | Latest National News, Videos & Photos - ABC News - ABC News",,,,,,
,Relevant,razed,8/31/2015 17:10,The Latest: More Homes Razed by Northern California Wildfire - ABC News http://t.co/ORdoKfUIBm,2891997062,1,6.29E+17,FALSE,5,,778252815,finalized,1,http://abcnews.go.com/US,http://abcnews.go.com/,"U.S.  News | Latest National News, Videos & Photos - ABC News - ABC News",,,,,,
,Relevant,razed,8/28/2015 3:23,The Latest: More Homes Razed by Northern California Wildfire - ABC News http://t.co/6AcSWzo7cw,463891190,1,6.29E+17,FALSE,5,,778252816,finalized,1,http://abcnews.go.com/US,http://abcnews.go.com/,"U.S.  News | Latest National News, Videos & Photos - ABC News - ABC News",,,,,,
,Relevant,razed,8/31/2015 17:19,The Latest: More Homes Razed by Northern California Wildfire - ABC News http://t.co/hCKxJ8eukt,2874845313,1,6.29E+17,FALSE,5,,778252817,finalized,1,http://abcnews.go.com/US,http://abcnews.go.com/,"U.S.  News | Latest National News, Videos & Photos - ABC News - ABC News",,,,,,
,Relevant,razed,8/30/2015 7:25,The Latest: More homes razed by #NorthernCalifornia wildfire http://t.co/mONiJJth7V #ZippedNews http://t.co/0yXBB5dzw5,2942029428,1,6.29E+17,FALSE,5,,778252818,finalized,1,http://www.dailymail.co.uk/wires/ap/article-3186084/The-Latest-Cooler-weather-aids-California-wildfire-battle.html?ITO=1490&ns_campaign=1490&ns_mchannel=rss,http://www.dailymail.co.uk/,The Latest: More homes razed by Northern California wildfire | Daily Mail Online,,,,,,
,Relevant,razed,8/27/2015 16:53,The Latest: More homes razed by Northern California wildfire - http://t.co/R1CNSjUAYQ http://t.co/DQ1yLcrF9K,1281506071,1,6.29E+17,FALSE,5,,778252819,finalized,1,http://www.chron.com/,http://www.chron.com/,"Houston News, Sports, Business, and Entertainment - The Houston Chronicle at Chron.com - Houston Chronicle",http://www.chron.com/news/us/article/The-Latest-Cooler-weather-aids-California-6426209.php,http://www.chron.com/,,,,
,Relevant,razed,8/28/2015 17:13,The Latest: More Homes Razed by Northern California Wildfire - ABC News http://t.co/lj4J54vxq3,2874903052,1,6.29E+17,FALSE,5,,778252821,finalized,1,http://abcnews.go.com/US,http://abcnews.go.com/,"U.S.  News | Latest National News, Videos & Photos - ABC News - ABC News",,,,,,
,Relevant,razed,8/27/2015 16:12,The Latest: More homes razed by Northern California wildfire - http://t.co/IrqUjaEsck http://t.co/qDwEknRMi9,3034853732,1,6.29E+17,FALSE,7,,778252822,finalized,1,http://www.chron.com/,http://www.chron.com/,"Houston News, Sports, Business, and Entertainment - The Houston Chronicle at Chron.com - Houston Chronicle",,,,,,
,Relevant,razed,9/1/2015 19:53,The Latest: More Homes Razed by Northern California Wildfire - ABC News http://t.co/aueZxZA5ak,2904380749,1,6.29E+17,FALSE,5,,778252823,finalized,1,http://abcnews.go.com/US,http://abcnews.go.com/,"U.S.  News | Latest National News, Videos & Photos - ABC News - ABC News",,,,,,
,Relevant,razed,8/27/2015 16:00,The Latest: More Homes Razed by Northern California Wildfire - ABC News http://t.co/VP6wbXMZmj,2862125872,1,6.29E+17,FALSE,6,,778252824,finalized,1,http://abcnews.go.com/US,http://abcnews.go.com/,"U.S.  News | Latest National News, Videos & Photos - ABC News - ABC News",,,,,,
,Relevant,refugees,8/27/2015 17:29,Police Monitoring 200 Jihadis in Poland http://t.co/1wCOfmLUb9 via @freedomoutpost,399707537,1,6.29E+17,FALSE,5,Ad Majorem Dei Glorium,778252827,finalized,1,http://freedomoutpost.com/?p=46729,http://freedomoutpost.com/,,,,,,,
,Relevant,refugees,8/29/2015 2:06,#retweet Cameroon repatriating about 12000 Nigerian refugees due to Boko Haram http://t.co/wvVgmejA7l,1615330951,1,6.29E+17,FALSE,5,paradise,778252833,finalized,1,http://www.gist360.com/2015/08/cameroon-repatriating-about-12000.html?utm_source=feedburner&utm_medium=twitter&utm_campaign=Feed%3A+gist360%2FWnHo+%28loveswaggs%29,http://www.gist360.com/,,,,,,,
,Relevant,refugees,8/29/2015 8:04,...//..// whao.. 12000 Nigerian refugees repatriated from Cameroon http://t.co/HuhWPmryWz,3014736279,1,6.29E+17,FALSE,5,,778252852,finalized,0,http://newsnigeria6.blogspot.co.il/2015/08/12000-nigerian-refugees-repatriated.html?utm_source=twitterfeed&utm_medium=twitter,http://newsnigeria6.blogspot.co.il/,,,,,,,
,Relevant,refugees,8/29/2015 1:38,"@fadelurker @dalinthanelan &lt; right now.

Even after two years there were still refugees camped just south of Redcliffe village and Aidan &gt;",220777203,1,6.29E+17,FALSE,5,Skyhold,778252855,finalized,0,,,,,,,,,
,Relevant,refugees,8/29/2015 9:55,In Photos: The Young Refugees Forced to Flee Burundi's Violence | VICE News https://t.co/jOjnq2oOPi see more http://t.co/DsKuI6Mmgl,109980164,1,6.29E+17,FALSE,5,"Amman,Jordan",778252857,finalized,1,https://news.vice.com/article/in-photos-the-young-refugees-forced-to-flee-burundis-violence,https://news.vice.com/,In Photos: The Young Refugees Forced to Flee Burundi's Violence | VICE News,http://tweetedtimes.com/v/1566,http://tweetedtimes.com/,The Tweeted Times - personal newspaper generated from your Twitter account,,,
,Relevant,refugees,8/29/2015 9:42,Still wonder why they will do anything to have a life anywhere. Wars u support CAUSE refugees open boarders. #auspol https://t.co/3MjtE74AiW,3097910934,1,6.29E+17,FALSE,5,lbtidronegirlshell ,778252869,finalized,0,https://twitter.com/sakirkhader/status/628975950261301248,https://twitter.com/,,,,,,,
,Relevant,refugees,8/31/2015 3:54,reaad/ plsss 12000 Nigerian refugees repatriated from Cameroon,2930524966,1,6.29E+17,FALSE,5,,778252870,finalized,0,,,,,,,,,
,Relevant,rescue,8/28/2015 2:55,UD: Rescue (Structural Collapse) - Scott Road @ Ypres Road York (14 Trucks),18409861,1,6.29E+17,FALSE,5,"Toronto, Ontario",778252881,finalized,1,,,,,,,,,
,Relevant,rescue,8/27/2015 16:11,Officials rescue 367 migrants off Libya; 25 bodies found - Fox News http://t.co/9CAignPR6S #NoAgenda #MvDint,1274923076,1,6.29E+17,FALSE,7,,778252894,finalized,1,http://www.foxnews.com/world/2015/08/05/officials-rescue-367-migrants-off-libya-25-bodies-found.html,http://www.foxnews.com/,Officials rescue 367 migrants off Libya; 25 bodies found  | Fox News,,,,,,
,Relevant,rescue,8/28/2015 17:09,Flood-zone : General Raheel Sharif visits Chitral: He  also lauded the efforts of  FWO army troops and army aviation in rescue opera...,1600384177,1,6.29E+17,FALSE,5,Karachi,778252902,finalized,1,,,,,,,,,
,Relevant,rescue,8/28/2015 3:08,Officials rescue 367 migrants off Libya; 25 bodies found - Fox News http://t.co/cEdCUgEuWs #News,1935760261,1,6.29E+17,FALSE,5,India,778252906,finalized,1,,,,,,,,,
,Relevant,rescued,8/31/2015 17:10,Britons rescued amid Himalaya floods (http://t.co/WGRXLy9pDO) http://t.co/BJ4hAAVAYE http://t.co/59p3AoIQUS,2249330958,1,6.29E+17,FALSE,5,,778252912,finalized,1,http://t.co/WGRXLy9pDO),http://t.co/,,,,,,,
,Relevant,rescued,8/29/2015 12:46,#news Britons rescued amid Himalaya floods http://t.co/kEPznhXHXd,3124658212,1,6.29E+17,FALSE,5,,778252930,finalized,1,http://www.bbc.co.uk/news/uk-33808426#sa-ns_mchannel=rss&ns_source=PublicRSS20-sa,http://www.bbc.co.uk/,British trekkers rescued amid flash floods in Himalayas - BBC News,,,,,,
,Relevant,rescued,8/29/2015 22:58,British trekkers rescued amid flash floods in Himalayas - BBC News,42251939,1,6.29E+17,FALSE,5,"Burnley, Lancashire",778252934,finalized,1,,,,,,,,,
,Relevant,rescued,8/31/2015 4:33,SkyNews: Migrant Boat Tragedy Survivors Arrive In Italy - Migrants rescued http://t.co/FORBy6MmKp,33290164,1,6.29E+17,FALSE,5,"Pembroke Dock, Wales",778252940,finalized,1,http://news.sky.com/story/migrant-boat-tragedy-survivors-arrive-in-italy-10350183,http://news.sky.com/,Migrant Boat Tragedy Survivors Arrive In Italy,,,,,,
,Relevant,rescued,8/31/2015 7:19,nigeriantribune: 4 kidnapped ladies rescued by police in Enugu | Nigerian Tribune http://t.co/7hmHpl1Z4y,2989557440,1,6.29E+17,FALSE,5,,778252941,finalized,1,http://www.tribuneonlineng.com/4-kidnapped-ladies-rescued-police-enugu,http://www.tribuneonlineng.com/,,,,,,,
,Relevant,rescued,8/27/2015 22:10,NAIROBI Kenya (AP) ‰׃ Two people died and 25 others were rescued after a passenger boat with about two dozen passengers collided with a,2347118120,1,6.29E+17,FALSE,5,,778252944,finalized,1,,,,,,,,,
,Relevant,rescued,8/27/2015 16:09,Britons rescued amid Himalaya floods http://t.co/8f2YBus2Vk,2837777528,1,6.29E+17,FALSE,5,Hyderabad Telangana INDIA,778252951,finalized,1,,,,,,,,,
,Relevant,rescued,8/29/2015 20:05,Photo: Hundreds of rescued migrants await disembarkment from an Irish naval vessel at Palermo Italy - @tconnellyR‰_ https://t.co/AIM5CYHL0y,2734103126,1,6.29E+17,FALSE,5,Jakarta/Kuala Lumpur/S'pore,778252957,finalized,1,,,,,,,,,
,Relevant,rescued,9/1/2015 17:06,Rescued Med migrants arrive in Sicily http://t.co/p4dOA5YYJe,495902693,1,6.29E+17,FALSE,5,Cape Town,778252958,finalized,1,http://www.bbc.co.uk/news/world-europe-33810119#sa-ns_mchannel=rss&ns_source=PublicRSS20-sa,http://www.bbc.co.uk/,Rescued Mediterranean migrants arrive in Sicily - BBC News,,,,,,
,Relevant,rescuers,8/29/2015 9:42,VIDEO: 'We're picking up bodies from water': Rescuers are searching for hundreds of migrants in ... http://t.co/bS6PjT09Tc #Africa #News,571096132,1,6.29E+17,FALSE,5,Nigeria,778252959,finalized,1,http://www.bbc.co.uk/news/av/world-africa-33798193/msf-in-mediterranean-we-re-picking-up-bodies-from-the-water,http://www.bbc.co.uk/,MSF in Mediterranean: 'We're picking up bodies from the water' - BBC News,,,,,,
,Relevant,rescuers,8/29/2015 10:20,VIDEO: 'We're picking up bodies from water': Rescuers are searching for hundreds of migrants in the Mediterran... http://t.co/s5NuEGSwYj,170283110,1,6.29E+17,FALSE,5,Westerland,778252960,finalized,1,http://www.bbc.co.uk/news/av/world-africa-33798193/msf-in-mediterranean-we-re-picking-up-bodies-from-the-water,http://www.bbc.co.uk/,MSF in Mediterranean: 'We're picking up bodies from the water' - BBC News,,,,,,
,Relevant,rescuers,8/27/2015 20:43,VIDEO: 'We're picking up bodies from water': Rescuers are searching for hundreds of migrants in the Mediterran... http://t.co/ciwwUQthin,250693957,1,6.29E+17,FALSE,5,Kuala Lumpur,778252961,finalized,1,http://www.bbc.co.uk/news/av/world-africa-33798193/msf-in-mediterranean-we-re-picking-up-bodies-from-the-water,http://www.bbc.co.uk/,MSF in Mediterranean: 'We're picking up bodies from the water' - BBC News,,,,,,
,Relevant,rescuers,8/29/2015 9:31,VIDEO: 'We're picking up bodies from water': Rescuers are searching for hundreds of migrants in the Mediterran... http://t.co/GEU4H46CsZ,1970814960,1,6.29E+17,FALSE,5,Surabaya,778252963,finalized,1,http://www.bbc.co.uk/news/av/world-africa-33798193/msf-in-mediterranean-we-re-picking-up-bodies-from-the-water,http://www.bbc.co.uk/,MSF in Mediterranean: 'We're picking up bodies from the water' - BBC News,,,,,,
,Relevant,rescuers,8/27/2015 16:12,VIDEO: 'We're picking up bodies from water' - Rescuers are searching for hundreds of migrants in the Mediterranean... http://t.co/yhQU5UV6Ok,872553170,1,6.29E+17,FALSE,8,#iminchina,778252964,finalized,1,http://www.bbc.co.uk/news/av/world-africa-33798193/msf-in-mediterranean-we-re-picking-up-bodies-from-the-water,http://www.bbc.co.uk/,MSF in Mediterranean: 'We're picking up bodies from the water' - BBC News,,,,,,
,Relevant,rescuers,8/27/2015 16:09,#italy Hundreds of Migrants Rescued After Boat Capsizes Off Libya: Rescuers saved 400 people though 25 died w... http://t.co/e48syD5N1E,19225574,1,6.29E+17,FALSE,6,"Rome, IT",778252965,finalized,1,https://www.nytimes.com/2015/08/06/world/europe/mediterranean-migrants-rescued-boat-capsizes-libya.html?partner=rssnyt&emc=rss&utm_medium=twitter&utm_source=twitterfeed,https://www.nytimes.com/,Hundreds of Migrants Rescued After Boat Capsizes Off Libya - The New York Times,,,,,,
,Relevant,rescuers,8/29/2015 1:50,#world Fears over missing migrants in Med: Rescuers search for survivors after a boat carrying as many a... http://t.co/6DS67XAI5e #news,1406925920,1,6.29E+17,FALSE,5,,778252966,finalized,1,http://news24h.allnews24h.com/suspended,http://news24h.allnews24h.com/,AdF.ly - Suspended,,,,,,
,Relevant,rescuers,8/31/2015 3:17,VIDEO: 'We're picking up bodies from water': Rescuers are searching for hundreds of migrants in the Mediterran... http://t.co/WvMHX5tiel,123911261,1,6.29E+17,FALSE,5,Worldwide,778252968,finalized,1,http://www.bbc.co.uk/news/av/world-africa-33798193/msf-in-mediterranean-we-re-picking-up-bodies-from-the-water,http://www.bbc.co.uk/,MSF in Mediterranean: 'We're picking up bodies from the water' - BBC News,,,,,,
,Relevant,rescuers,8/27/2015 15:51,Rescuers are searching for hundreds of migrants in the Mediterranean after a boat carrying as many as 600 people‰_,438523023,1,6.29E+17,FALSE,5,,778252969,finalized,1,,,,,,,,,
,Relevant,rescuers,8/27/2015 14:56,#RoddyPiperAutos Fears over missing migrants in Med: Rescuers search for survivors after a boat carrying as ma...  http://t.co/97B8AVgEWU,1941377190,1,6.29E+17,FALSE,6,Nigeria,778252972,finalized,1,http://globalautomobilequote.blogspot.co.il/,http://globalautomobilequote.blogspot.co.il/,,,,,,,
,Relevant,rescuers,8/30/2015 10:54,VIDEO: 'We're picking up bodies from water': Rescuers are searching for hundreds of migrants in the Mediterranean after a boat carryi...,610168005,1,6.29E+17,FALSE,5,,778252975,finalized,1,,,,,,,,,
,Relevant,rescuers,8/27/2015 20:59,Fears over missing migrants in Med: Rescuers search for survivors after a boat carrying as many as 600 migrants‰_ http://t.co/UUHNC8ZkOW,2385531896,1,6.29E+17,FALSE,5,,778252977,finalized,1,,,,,,,,,
,Relevant,rescuers,8/27/2015 16:05,VIDEO: 'We're picking up bodies from water': Rescuers are searching for hundreds of migrants in the Mediterran... http://t.co/zG1YddywA5,351701013,1,6.29E+17,FALSE,6,,778252978,finalized,1,http://www.bbc.co.uk/news/av/world-africa-33798193/msf-in-mediterranean-we-re-picking-up-bodies-from-the-water,http://www.bbc.co.uk/,MSF in Mediterranean: 'We're picking up bodies from the water' - BBC News,,,,,,
,Relevant,rescuers,9/1/2015 18:05,VIDEO: 'We're picking up bodies from water': Rescuers are searching for hundreds of migrants in the Mediterran... http://t.co/PUezv6bd37,341611261,1,6.29E+17,FALSE,5,London,778252979,finalized,1,http://www.bbc.co.uk/news/av/world-africa-33798193/msf-in-mediterranean-we-re-picking-up-bodies-from-the-water,http://www.bbc.co.uk/,MSF in Mediterranean: 'We're picking up bodies from the water' - BBC News,,,,,,
,Relevant,rescuers,9/1/2015 13:36,VIDEO: 'We're picking up bodies from water': Rescuers are searching for hundreds of migrants in the Mediterranean after a boat carryi...,710776945,1,6.29E+17,FALSE,5,,778252980,finalized,1,,,,,,,,,
,Relevant,rescuers,8/27/2015 15:58,VIDEO: 'We're picking up bodies from water': Rescuers are searching for hundreds of migrants in ... http://t.co/awtScUCBBV #Africa #News,185871910,1,6.29E+17,FALSE,6,,778252981,finalized,1,http://www.bbc.co.uk/news/av/world-africa-33798193/msf-in-mediterranean-we-re-picking-up-bodies-from-the-water,http://www.bbc.co.uk/,MSF in Mediterranean: 'We're picking up bodies from the water' - BBC News,,,,,,
