choose_one_gold,choose_one,keyword,_last_judgment_at,text,userid,choose_one:confidence,tweetid,_golden,_trusted_judgments,location,_unit_id,_unit_state,objective,link_url1,link_uri1,link_title1,link_url2,link_uri2,link_title2,link_url3,link_uri3,link_title3
,Relevant,avalanche,8/29/2015 20:39,Senators have another year to determine Hoffman's v... #ColoradoAvs #NHLAvalanche http://t.co/CIzZOc6f0D http://t.co/PEmYHD3Nfz,3020517836,1,6.29E+17,FALSE,5,"Denver, CO",778245596,finalized,1,,,,,,,,,
,Relevant,avalanche,8/28/2015 20:37,Now there's an avalanche... These men are lunatics #livingontheedge,1046235356,1,6.29E+17,FALSE,5,,778245609,finalized,0,,,,,,,,,
,Relevant,bioterror,8/29/2015 18:44,FedEx no longer to transport bioterror germs in wake of anthrax lab mishaps http://t.co/kA0syAhqVW via @usatoday,2792464926,1,6.27E+17,FALSE,5,,778245647,finalized,1,https://www.usatoday.com/story/news/2015/07/29/fedex-no-longer-transport-bioterror-germs-wake-anthrax-lab-mishaps/30850671/,https://www.usatoday.com/,FedEx no longer to transport bioterror germs in wake of anthrax lab mishaps,,,,,,
,Relevant,bioterror,8/28/2015 7:40,FedEx no longer to transport bioterror germs in wake of anthrax lab mishaps http://t.co/HQsU8LWltH via @usatoday,2831716679,1,6.27E+17,FALSE,5,"West Virginia, USA",778245650,finalized,1,https://www.usatoday.com/story/news/2015/07/29/fedex-no-longer-transport-bioterror-germs-wake-anthrax-lab-mishaps/30850671/,https://www.usatoday.com/,FedEx no longer to transport bioterror germs in wake of anthrax lab mishaps,,,,,,
,Relevant,bioterror,9/1/2015 6:44,FedEx not willing to transport research specimens of potential bioterror pathogens in wake of anthrax lab mishaps  http://t.co/cM8UnI1mRG,22659924,1,6.27E+17,FALSE,5,Memphis,778245662,finalized,1,https://www.usatoday.com/story/news/2015/07/29/fedex-no-longer-transport-bioterror-germs-wake-anthrax-lab-mishaps/30850671/,https://www.usatoday.com/,FedEx no longer to transport bioterror germs in wake of anthrax lab mishaps,,,,,,
,Relevant,bioterror,8/28/2015 11:46,FedEx no longer to transport bioterror germs in wake of anthrax lab mishaps http://t.co/P96rgBbaYL #news #phone #apple #mobile,2615643894,1,6.27E+17,FALSE,5,,778245665,finalized,1,https://www.hugedomains.com/domain_profile.cfm?d=dailygeeky&e=com,https://www.hugedomains.com/,HugeDomains.com - Dailygeeky.com is for sale (Dailygeeky),,,,,,
,Relevant,bioterror,8/29/2015 20:15,Hmm...this could be problem for some researchers: FedEx no longer to transport select agents http://t.co/9vIibxgjAV via @usatoday,1365679645,1,6.27E+17,FALSE,5,"Oxford, MS",778245668,finalized,0,https://www.usatoday.com/story/news/2015/07/29/fedex-no-longer-transport-bioterror-germs-wake-anthrax-lab-mishaps/30850671/,https://www.usatoday.com/,FedEx no longer to transport bioterror germs in wake of anthrax lab mishaps,,,,,,
,Relevant,bioterror,8/28/2015 7:32,#FedEx no longer to transport #bioterror germs in wake of #anthrax lab mishaps http://t.co/Ziw1RWPJkK,529724032,1,6.27E+17,FALSE,5,,778245670,finalized,1,https://www.usatoday.com/story/news/2015/07/29/fedex-no-longer-transport-bioterror-germs-wake-anthrax-lab-mishaps/30850671/,https://www.usatoday.com/,FedEx no longer to transport bioterror germs in wake of anthrax lab mishaps,,,,,,
,Relevant,bioterror,8/29/2015 10:16,In offbeat news @fedex has stopped shipping bioterror pathogens http://t.co/gvXXidHOlF,21874587,1,6.27E+17,FALSE,5,"Jacksonville, Florida",778245681,finalized,1,https://www.bizjournals.com/jacksonville/blog/morning-edition/2015/07/fedex-stops-shipping-potential-bioterror-pathogens.html?ana=twt,https://www.bizjournals.com/,,,,,,,
,Relevant,bioterror,8/29/2015 12:59,FedEx no longer to transport bioterror germs in wake of anthrax lab mishaps http://t.co/RghHkWtKLR #newsdict #news  #FedEx,3138554150,1,6.27E+17,FALSE,5,,778245685,finalized,1,,,,,,,,,
,Relevant,bioterror,8/29/2015 21:10,FedEx no longer to transport bioterror germs in wake of anthrax lab mishaps http://t.co/c0p3SEsqWm via @usatoday,112886485,1,6.27E+17,FALSE,5,"Melbourne, Florida",778245686,finalized,1,https://www.usatoday.com/story/news/2015/07/29/fedex-no-longer-transport-bioterror-germs-wake-anthrax-lab-mishaps/30850671/,https://www.usatoday.com/,FedEx no longer to transport bioterror germs in wake of anthrax lab mishaps,,,,,,
,Relevant,bioterror,8/28/2015 17:02,#FedEx no longer to transport bioterror germs in wake of anthrax lab mishaps http://t.co/S4SiCMYRmH,125833800,1,6.28E+17,FALSE,5,Over the Moon...,778245689,finalized,1,https://www.usatoday.com/story/news/2015/07/29/fedex-no-longer-transport-bioterror-germs-wake-anthrax-lab-mishaps/30850671/,https://www.usatoday.com/,FedEx no longer to transport bioterror germs in wake of anthrax lab mishaps,,,,,,
,Relevant,bioterrorism,9/1/2015 18:03,The largest bioterrorism attack on U.S. soil involved tacos @atlasobscura http://t.co/1n9CRhWmgl,16372540,1,6.26E+17,FALSE,5,Los Angeles,778245696,finalized,1,http://www.atlasobscura.com/articles/100-wonders-its-taco-time,http://www.atlasobscura.com/,100 Wonders: Taco Time - Atlas Obscura,,,,,,
,Relevant,bioterrorism,8/28/2015 3:23,I liked a @YouTube video http://t.co/XO2ZbPBJB3 FEMA REGION III TARGETED for BIOTERRORISM !!! NASA - JAPAN ROCKET LAUNCH with LITHIUM,43925872,1,6.27E+17,FALSE,5,OES 4th Point. sisSTAR & TI,778245698,finalized,0,https://www.youtube.com/watch?v=OM17Hb384UA&feature=youtu.be&a,https://www.youtube.com/,FEMA REGION III TARGETED for BIOTERRORISM !!! NASA - JAPAN ROCKET LAUNCH with LITHIUM DEPLOYMENT - YouTube,,,,,,
,Relevant,bioterrorism,9/1/2015 16:27,Bioterrorism public health superbug biolabs epidemics biosurveillance outbreaks | Homeland Security News Wire http://t.co/cvhYGwcBZv,269852516,1,6.27E+17,FALSE,5,,778245706,finalized,1,,,,,,,,,
,Relevant,bioterrorism,9/1/2015 16:27,To fight bioterrorism sir.,996963876,1,6.28E+17,FALSE,5,,778245738,finalized,1,,,,,,,,,
,Relevant,bioterrorism,8/29/2015 1:02,@prsnvns that's good to hear. Mine could be better but I can manage. It's alright you do what you have to. Bioterrorism doesn't wait.,163249152,1,6.29E+17,FALSE,5,Philippines :),778245741,finalized,0,,,,,,,,,
,Relevant,blaze,8/29/2015 23:00,Pendleton media office said only fire on base right now is the Horno blaze.,381263025,1,6.29E+17,FALSE,5,"Temecula, CA",778245754,finalized,1,,,,,,,,,
,Relevant,blaze,8/27/2015 19:21,#breaking Firefighters battling blaze at east Cary condo building http://t.co/mIM8hH2ce6,18342955,1,6.29E+17,FALSE,5,"Raleigh Durham, NC",778245762,finalized,1,http://abc11.com/news/firefighters-battling-blaze-at-west-cary-condo-building/905582/,http://abc11.com/,Firefighters battle blaze at east Cary condo building | abc11.com,,,,,,
,Relevant,blaze,8/31/2015 17:21,Port Coquitlam fire crews say an electric towel warmer started the four alarm blaze last week that destroyed several businesses.,71080496,1,6.29E+17,FALSE,5,Vancouver,778245766,finalized,1,,,,,,,,,
,Relevant,blaze,8/28/2015 12:46,Property losses from #California wildfire nearly double as week-old blaze rages: The fire‰_ http://t.co/MsdizftZ2g,16252903,1,6.29E+17,FALSE,5,Karachi ,778245780,finalized,1,,,,,,,,,
,Relevant,blazing,8/29/2015 10:12,Satelite Shot: Series of wildfires in Northern California continue blazing: There are at least five fire compl... http://t.co/BmGuHqY7W4,21276122,1,6.29E+17,FALSE,5,On The Net,778245832,finalized,1,https://watchers.news/2015/08/05/series-of-wildfires-in-northern-california-continue-blazing/?utm_source=twitterfeed&utm_medium=twitter,https://watchers.news/,Series of wildfires in Northern California continue blazing,,,,,,
,Relevant,blazing,9/1/2015 4:45,@BlazingRoselia California is hot but not blazing even though there are wildfires going on now. Even the big massive Rocky fire,141393104,1,6.29E+17,FALSE,5,"Sacramento, California",778245844,finalized,1,,,,,,,,,
,Relevant,blew%20up,8/28/2015 11:30,Did anyone else see that fireball falling to earth? Look like a plane blew up.,739492068,1,6.29E+17,FALSE,5,,778245938,finalized,0,,,,,,,,,
,Relevant,blight,8/29/2015 12:49,Lots of talk of how susceptible NY2 is to shoot blight with or without trama. #WCFGT2015,1043133102,1,6.29E+17,FALSE,5,"Cleveland, Ohio",778245951,finalized,0,,,,,,,,,
,Relevant,bloody,8/29/2015 18:39,Bloody insomnia again! Grrrr!! #Insomnia,44176848,1,6.29E+17,FALSE,5,Leicester,778246112,finalized,0,,,,,,,,,
,Relevant,bloody,8/31/2015 6:46,'I came to kill Indians...for FUN': Video of smirking and remorseless Pakistani killer shows him boasting. http://t.co/FPjLwOXKlg,1019563982,1,6.29E+17,FALSE,5,Isolated City In World Perth,778246140,finalized,1,http://www.dailymail.co.uk/indiahome/indianews/article-3186346/I-came-kill-Indians-FUN-Video-smirking-remorseless-Pakistani-killer-shot-two-servicemen-Udhampur-shows-boasting-bloody-murders.html,http://www.dailymail.co.uk/,'I came to kill Indians...for FUN': Video of smirking and remorseless Pakistani killer who shot two servicemen in Udhampur shows him boasting of his bloody murders  | Daily Mail Online,,,,,,
,Relevant,blown%20up,8/31/2015 4:44,Deadly suicide bombing hits mosque in Saudi Arabia: A suicide bomber has blown himself up at a mosque in the s... http://t.co/RkvU3xjAzH,369760961,1,6.29E+17,FALSE,5,"Paterson, New Jersey ",778246171,finalized,1,http://www.dw.com/en/islamic-state-group-claims-saudi-mosque-suicide-blast/a-18632208?maca=en-rss-en-world-4025-rdf&utm_source=twitterfeed&utm_medium=twitter,http://www.dw.com/,′Islamic State′ group claims Saudi mosque suicide blast | News | DW | 06.08.2015,,,,,,
,Relevant,body%20bags,8/29/2015 12:49,Womens Flower Printed Shoulder Handbags Cross Body Metal Chain Satchel Bags Pink http://t.co/vBZqWzNxH7 http://t.co/NXIhHeP1Ea,3076019319,1,6.29E+17,FALSE,5,,778246344,finalized,1,http://ww35.nice-deals-review-elegant-reviews.newoffers.info/buy/01/?query=281766565927,http://ww35.nice-deals-review-elegant-reviews.newoffers.info/,,,,,,,
,Relevant,bomb,9/1/2015 16:20,Hiroshima prepares to remember the day the bomb dropped http://t.co/oJHCGZXLSt,532727164,1,6.29E+17,FALSE,5,"Bolton & Tewkesbury, UK",778246350,finalized,1,https://www.theguardian.com/world/2015/aug/05/hiroshima-prepares-to-remember-the-day-the-bomb-dropped?CMP=share_btn_tw,https://www.theguardian.com/,Hiroshima remembers the day the bomb dropped | World news | The Guardian,,,,,,
,Relevant,bomb,8/28/2015 8:43,Hiroshima marks 70 years since bomb: The Japanese city of Hiroshima marks the 70th anniversary of the dropping... http://t.co/INRGS4z0AC,323685593,1,6.29E+17,FALSE,5,,778246352,finalized,1,http://www.bbc.co.uk/news/world-asia-33792789#sa-ns_mchannel=rss&ns_source=PublicRSS20-sa?utm_source=Slowest+Poison&utm_medium=twitter,http://www.bbc.co.uk/,Hiroshima marks 70 years since atomic bomb - BBC News,,,,,,
,Relevant,bomb,9/1/2015 15:48,New Documents Found Pointing To Japan's WWII Atomic Bomb Program http://t.co/IucPcSfbMT,241802605,1,6.29E+17,FALSE,5,Australia,778246361,finalized,1,http://foxtrotalpha.jalopnik.com/new-documents-found-pointing-to-japanese-atomic-bomb-pr-1722338915,http://foxtrotalpha.jalopnik.com/,New Documents Found Pointing To Japan's WWII Atomic Bomb Program,,,,,,
,Relevant,bomb,8/27/2015 16:26,RIP RT @AJENews: On Aug. 6 1945 at 8:16 AM Tokyo time the world‰×s 1st atom bomb on Hiroshima http://t.co/6Q5CS9MCdW http://t.co/7OGFoQr0MG,48009202,1,6.29E+17,FALSE,6,N 51ו¡25' 0'' / W 0ו¡45' 0'',778246364,finalized,0,,,,,,,,,
,Relevant,bomb,8/30/2015 7:12,@smallforestelf Umm because a gun stopped the gunman with who was carrying a bomb!,2717346016,1,6.29E+17,FALSE,5,,778246365,finalized,0,,,,,,,,,
,Relevant,bomb,8/31/2015 10:21,The crew on #EnolaGay had nuclear bomb on board disarmed. 15 mins to #Hiroshima they got ready to arm Little Boy http://t.co/JB25fHKe6q,24177470,1,6.29E+17,FALSE,5,Ireland,778246372,finalized,1,https://twitter.com/GavinDuffy/status/629079266341310464/photo/1,https://twitter.com/,"Gavin Duffy on Twitter: ""The crew on #EnolaGay had nuclear bomb on board disarmed. 15 mins to #Hiroshima they got ready to arm Little Boy http://t.co/JB25fHKe6q""",,,,,,
,Relevant,bomb,8/27/2015 14:53,&lt;Kyodonews&gt; UPDATE1: Hiroshima marks 70th A-bomb anniv. amid fears of eroded pacifism http://t.co/VpGu8z1Lhb #followme #japan,134758514,1,6.29E+17,FALSE,5,SHIBUYA TOKYO JAPAN,778246382,finalized,1,https://english.kyodonews.jp/login,https://english.kyodonews.jp/,Login - Kyodo News,,,,,,
,Relevant,bomb,8/29/2015 10:14,What would it look like if Hiroshima bomb hit Detroit?: Thursday marks the 70-year anniversary of the United S... http://t.co/6sy44kyYsD,2849708643,1,6.29E+17,FALSE,5,,778246385,finalized,1,,,,,,,,,
,Relevant,bomb,8/29/2015 12:47,The hatchet-wielding gunman had PEPPER SPRAY AND A FAKE BOMB?!?!?,376874857,1,6.29E+17,FALSE,5,,778246389,finalized,0,,,,,,,,,
,Relevant,bomb,8/29/2015 10:24,The Guardian view on the Hiroshima legacy: still in the shadow of the bomb | Editorial: The world longs to cas... http://t.co/ct2JUtvYTg,588945219,1,6.29E+17,FALSE,5,,778246391,finalized,1,https://feeds.theguardian.com/c/34708/f/663879/s/48be461f/sc/7/l/0L0Stheguardian0N0Ccommentisfree0C20A150Caug0C0A60Cthe0Eguardian0Eview0Eon0Ethe0Ehiroshima0Elegacy0Estill0Ein0Ethe0Eshadow0Eof0Ethe0Ebomb/story01.htm?utm_source=twitterfeed&utm_medium=twitter,https://feeds.theguardian.com/,,,,,,,
,Relevant,bombed,8/29/2015 8:04,The U.S. bombed Hiroshima 70 years ago today. A look at how war has changed since: http://t.co/UQnj6nk9y3 http://t.co/QLnnMxzFqK,28421825,1,6.29E+17,FALSE,5,New York,778246401,finalized,1,http://www.nyu.edu/about/news-publications/news/features.html,http://www.nyu.edu/,,,,,,,
,Relevant,bombed,8/28/2015 19:42,At this hour 70 yrs ago one of the greatest acts of mass murder in world history occurred when #Hiroshima was bombed. http://t.co/2QJl5MfKzv,172743169,1,6.29E+17,FALSE,5,New York,778246402,finalized,0,https://twitter.com/JuanMThompson/status/629065987304882177/photo/1,https://twitter.com/,,,,,,,
,Relevant,bombed,8/29/2015 20:45,70 years ago nowish America bombed #Hiroshima. Was it justified? All I can say is #noMOREHiroshimas #VJDay70 #FEPOW http://t.co/SYADSa6QeS,2561709997,1,6.29E+17,FALSE,5,,778246405,finalized,0,https://www.facebook.com/events/385294564993823/,https://www.facebook.com/,‪Universal Peace Day 2015‬,,,,,,
,Relevant,bombed,8/29/2015 22:52,#Hiroshima does not look like a bombed city. It looks as if a monster steamroller had passed over it and squashed it out of existence.,834553604,1,6.29E+17,FALSE,5,,778246408,finalized,0,,,,,,,,,
,Relevant,bombed,9/1/2015 4:45,The majority of those killed were civilians on the ground after the jet first bombed the city's main street then dramatically plummeted,2346972990,1,6.29E+17,FALSE,5,,778246409,finalized,0,,,,,,,,,
,Relevant,bombed,9/1/2015 16:20,70 years ago at this hour the USA A-bombed Hiroshima therein killing 200000 civilians. Never forget the crime and never repeat. Peace ??,23442809,1,6.29E+17,FALSE,5,Tokyo,778246410,finalized,0,,,,,,,,,
,Relevant,bombed,9/2/2015 12:09,On 1st August #Turkish jets bombed the village Zergele in Qendil and killed 8 civilians and 15 others wounded,435725661,1,6.29E+17,FALSE,5,"Dּ_sseldorf, Germany",778246411,finalized,1,,,,,,,,,
,Relevant,bombed,8/28/2015 3:20,6th July 1945 ...Hiroshima was bombed with nuclear weapon _bomb was named little boy&amp;carried in a plane called Enola Gay ...1/2,2160285660,1,6.29E+17,FALSE,5,"Jaipur, Rajasthan",778246414,finalized,1,,,,,,,,,
,Relevant,bombed,8/29/2015 10:30,"'the third generation atomic bombed survivor' Photo exhibition 11:00 to 18:00 8/6. 
#?? #Hiroshima http://t.co/gVAipmLSl0",258352352,1,6.29E+17,FALSE,5,??,778246416,finalized,1,https://twitter.com/dounehiroko/status/629060981260324864/photo/1,https://twitter.com/,"堂畝 紘子 on Twitter: """"the third generation atomic bombed survivor"" Photo exhibition 11:00 to 18:00, 8/6. 
#広島 #Hiroshima http://t.co/gVAipmLSl0""",,,,,,
,Relevant,bombed,8/28/2015 6:14,.@Vagersedolla visits villages recently bombed by Turkey and finds people fed up with the PKK http://t.co/UUWEiKD7sP,135640929,1,6.29E+17,FALSE,5,Erbil,778246430,finalized,1,http://warisboring.com/articles/turkish-jets-bombed-these-villages/,http://warisboring.com/,,,,,,,
,Relevant,bombed,8/27/2015 16:05,Today Japan marks 70 yrs since the U.S (A) bombed 2 cities killing over 120000 people But we have to worry about Iran http://t.co/FcIXk23XQH,1460961332,1,6.29E+17,FALSE,6,melbourne,778246437,finalized,0,https://twitter.com/nomads_assasin/status/629073850592931840/photo/1,https://twitter.com/,"Red Revolt on Twitter: ""Today Japan marks 70 yrs since the U.S (A) bombed 2 cities killing over 120000 people But we have to worry about Iran http://t.co/FcIXk23XQH""",,,,,,
,Relevant,bombed,8/28/2015 20:37,Storm in RI worse than last hurricane. My city&amp;3others hardest hit. My yard looks like it was bombed. Around 20000K still without power,18029781,1,6.29E+17,FALSE,5,"Warwick, RI @Dollarocracy also",778246442,finalized,0,,,,,,,,,
,Relevant,bombing,9/1/2015 13:44,Bombing of Hiroshima 1945. http://t.co/4UHq9jKCvq,210912883,1,6.29E+17,FALSE,5,,778246445,finalized,1,https://www.pinterest.com/pin/515169644853177616/,https://www.pinterest.com/,"Bombing of Hiroshima, 1945. | World War 2 | Pinterest | Hiroshima",,,,,,
,Relevant,bombing,8/28/2015 3:37,We dont really talk about the murder of the bombing campaigns in WWII because we won but murder it is. https://t.co/jsGwnY6kdJ,543918403,1,6.29E+17,FALSE,5,These United States,778246446,finalized,0,https://twitter.com/NBCNews/status/629081798610427905,https://twitter.com/,"NBC News on Twitter: ""Hiroshima marks 70th anniversary of Atom Bomb with prayers and tears http://t.co/j5kzTxE1jO http://t.co/4GxV11RRb3""",,,,,,
,Relevant,bombing,8/27/2015 14:39,The United Kingdom and France are bombing Daesh in Syria - Voltaire Network http://t.co/zYSsObXNtC,551958938,1,6.29E+17,FALSE,5,,778246447,finalized,1,,,,,,,,,
,Relevant,bombing,9/2/2015 8:57,It's been 70 years (and one hour) since the bombing of Hiroshima. Let's take this time to remember.,3119227615,1,6.29E+17,FALSE,5,Shipwreck Cove,778246448,finalized,0,,,,,,,,,
,Relevant,bombing,9/1/2015 19:01,#Hiroshima marks 70th anniversary of atomic bombing ( via NHK WORLD News) http://t.co/qGWoyNJLY8,160232358,1,6.29E+17,FALSE,5,Tokyo JAPAN,778246451,finalized,1,http://www3.nhk.or.jp/nhkworld/english/news/20150806_01.html,http://www3.nhk.or.jp/,,,,,,,
,Relevant,bombing,8/28/2015 6:21,Today marks the 70th anniversary of the bombing of Hiroshima a city I visited and was humbled by in November 2013 http://t.co/AcC1z5Q9Zw,183972603,1,6.29E+17,FALSE,5,"Sydney, Australia",778246452,finalized,0,https://mariotravels.wordpress.com/2014/11/14/hiroshima/,https://mariotravels.wordpress.com/,Humbled in Hiroshima – Mario Travels,,,,,,
,Relevant,bombing,8/27/2015 13:35,@moscow_ghost @sayed_ridha @Amin_Akh congratulations on capturing a besieged city after 3 months of indiscriminate bombing by land &amp; air,2613242640,1,6.29E+17,FALSE,5,,778246453,finalized,0,,,,,,,,,
,Relevant,bombing,8/30/2015 7:20,The cryptic words that guided pilots on the Hiroshima bombing mission http://t.co/nSS5L64cvR #canada,2298075552,1,6.29E+17,FALSE,5,,778246455,finalized,1,http://dragplus.com/web/go/?title=canada&utm_source=twitter&utm_medium=link&utm_campaign=canada&utm_term=canada&url=http://feedproxy.google.com/~r/TheGlobeAndMail-Front/~3/jIhOAxnp_UE/,http://dragplus.com/,,,,,,,
,Relevant,bombing,8/28/2015 17:00,Just Happened in Asia: Japan marks 70th anniversary of Hiroshima atomic bombing http://t.co/E5dEmdScEh,246109715,1,6.29E+17,FALSE,5,South East Asia,778246457,finalized,1,http://www.channelnewsasia.com/news/asiapacific/japan-marks-70th/2032662.html,http://www.channelnewsasia.com/,,,,,,,
,Relevant,bombing,8/29/2015 9:57,What it was like to survive the atomic bombing of Hiroshima http://t.co/0cvXS2E1Er,155913366,1,6.29E+17,FALSE,5,London,778246458,finalized,1,https://www.washingtonpost.com/news/worldviews/wp/2015/08/05/what-it-was-like-to-survive-the-atomic-bombing-of-hiroshima/?postshare=7011438725846349,https://www.washingtonpost.com/,What it was like to survive the atomic bombing of Hiroshima - The Washington Post,,,,,,
,Relevant,bombing,8/28/2015 8:01,#Setting4Success Bells toll in Hiroshima as Japan marks 70 years since atomic bombing #News #smallbusiness #entrepreneur,714901117,1,6.29E+17,FALSE,5,,778246459,finalized,1,,,,,,,,,
,Relevant,bombing,8/29/2015 3:48,#Australia #News ; #Japan marks 70th anniversary of #Hiroshima atomic bombing  http://t.co/7aD0L7cgee READ MORE; http://t.co/hHzQl9tzNP,2373570728,1,6.29E+17,FALSE,5,WorldWide,778246460,finalized,1,http://www.abc.net.au/news/2015-08-06/japan-marks-70-years-since-hiroshima-bombing/6676444,http://www.abc.net.au/,Japan marks 70th anniversary of Hiroshima atomic bombing with a moment of silence - ABC News (Australian Broadcasting Corporation),https://twitter.com/abcnews/status/629080262626816000,https://twitter.com/,"ABC News on Twitter: ""#Japan marks 70th anniversary of #Hiroshima atomic bombing  http://t.co/tt58HB1YYJ""",,,
,Relevant,bombing,9/2/2015 7:52,The cryptic words that guided pilots on the Hiroshima bombing mission http://t.co/39IAbcC5pK,2273295306,1,6.29E+17,FALSE,5,,778246462,finalized,1,http://newsquebec.ca/?p=1252861,http://newsquebec.ca/,Coming Soon Page,,,,,,
,Relevant,bombing,8/29/2015 20:45,70th anniversary of Hiroshima atomic bombing marked  http://t.co/1mGvd4x5Oe,3246338907,1,6.29E+17,FALSE,5,,778246463,finalized,1,https://www.youtube.com/watch?v=yG08hLEWzyM,https://www.youtube.com/,Solo Violin - Schizophrenia (female string) - YouTube,,,,,,
,Relevant,bombing,8/29/2015 2:40,Japan Marks 70th Anniversary of Hiroshima Atomic Bombing http://t.co/93vqkdFgnr,194499826,1,6.29E+17,FALSE,5,,778246464,finalized,1,http://abcnews.go.com/International,http://abcnews.go.com/,"International News | Latest World News, Videos & Photos -ABC News  - ABC News",,,,,,
,Relevant,bombing,8/28/2015 11:42,Japan Marks 70th Anniversary of Hiroshima Atomic Bombing http://t.co/cQLM9jOJOP,320726331,1,6.29E+17,FALSE,5,"Overland Park, KS",778246465,finalized,1,http://abcnews.go.com/International,http://abcnews.go.com/,"International News | Latest World News, Videos & Photos -ABC News  - ABC News",,,,,,
,Relevant,bombing,8/29/2015 12:55,Japan Marks 70th Anniversary of Hiroshima Atomic Bombing http://t.co/3EV07PPaPn,2593165068,1,6.29E+17,FALSE,5,SWMO,778246466,finalized,1,http://abcnews.go.com/International,http://abcnews.go.com/,"International News | Latest World News, Videos & Photos -ABC News  - ABC News",,,,,,
,Relevant,bombing,8/27/2015 13:48,70th Anniversary of Hiroshima bombing https://t.co/juwvomhGPd,145596195,1,6.29E+17,FALSE,6,,778246467,finalized,1,https://www.yahoo.com/news/photos/68th-anniversary-of-hiroshima-bombing-1375800561-slideshow/,https://www.yahoo.com/,70th Anniversary of Hiroshima bombing,,,,,,
,Relevant,bombing,8/27/2015 15:23,Japan Marks 70th Anniversary of Hiroshima Atomic Bombing http://t.co/jzgxwRgFQg,429432944,1,6.29E+17,FALSE,6,Puerto Rico,778246468,finalized,1,http://abcnews.go.com/International,http://abcnews.go.com/,"International News | Latest World News, Videos & Photos -ABC News  - ABC News",,,,,,
,Relevant,bombing,8/29/2015 8:06,Hiroshima bombing justified: Majority Americans even today - Hindustan Times http://t.co/cC9z5asVZh,343405144,1,6.29E+17,FALSE,5,Silicon Valley,778246470,finalized,0,http://www.hindustantimes.com/world/hiroshima-bombing-justified-majority-americans-even-today/story-gLp1sqjau7ZyDfpkBT2bfI.html,http://www.hindustantimes.com/,Hiroshima bombing justified: Majority Americans even today | world | Hindustan Times,,,,,,
,Relevant,bombing,8/31/2015 17:19,Japan marks the 70th anniversary of the atomic bombing of Hiroshima. http://t.co/YmKn1IwPvF http://t.co/mMmJ8Bo9y3,330826792,1,6.29E+17,FALSE,5,Philippines,778246471,finalized,1,http://www.rappler.com/world/regions/asia-pacific/101709-japan-marks-70th-anniversary-hiroshima-atomic-bombing?utm_content=buffere4e2a&utm_medium=social&utm_source=twitter.com&utm_campaign=buffer,http://www.rappler.com/,Japan marks 70th anniversary of Hiroshima atomic bombing,https://twitter.com/rapplerdotcom/status/629083169795514368/photo/1,https://twitter.com/,"Rappler on Twitter: ""Japan marks the 70th anniversary of the atomic bombing of Hiroshima. http://t.co/YmKn1IwPvF http://t.co/mMmJ8Bo9y3""",,,
,Relevant,bombing,8/31/2015 4:49,'Japan Marks 70th Anniversary of Hiroshima Atomic Bombing' by THE ASSOCIATED PRESS via NYT http://t.co/kKULqGB9e3,2837471673,1,6.29E+17,FALSE,5,Kill Devil Hills,778246472,finalized,1,https://www.nytimes.com/aponline/2015/08/05/world/asia/ap-as-japan-hiroshima-anniversary.html,https://www.nytimes.com/,,,,,,,
,Relevant,bombing,8/29/2015 20:15,The 'sanitised narrative' of Hiroshima's atomic bombing. #Hiroshima70 #japan http://t.co/zsyj6sqYCn,88079764,1,6.29E+17,FALSE,5,"Derbyshire, England",778246475,finalized,0,http://www.bbc.co.uk/news/world-asia-33754931,http://www.bbc.co.uk/,Hiroshima: The human cost and the historical narrative - BBC News,,,,,,
,Relevant,bombing,8/28/2015 7:47,#Japan marks 70th anniversary of #Hiroshima atomic bombing (from @AP) http://t.co/qREInWg0GS,20859275,1,6.29E+17,FALSE,5,"Washington, DC",778246476,finalized,1,https://apnews.com/,https://apnews.com/,Associated Press News,,,,,,
,Relevant,bombing,8/30/2015 1:53,Today is the day Hiroshima got Atomic bomb 70 years ago.  - The 'sanitised narrative' of Hiroshima's atomic bombing http://t.co/GKpANz7vg0,3242878916,1,6.29E+17,FALSE,5,,778246477,finalized,0,http://www.bbc.com/news/world-asia-33754931,http://www.bbc.com/,Hiroshima: The human cost and the historical narrative - BBC News,,,,,,
