choose_one_gold,choose_one,keyword,_last_judgment_at,text,userid,choose_one:confidence,tweetid,_golden,_trusted_judgments,location,_unit_id,_unit_state,objective,link_url1,link_uri1,link_title1,link_url2,link_uri2,link_title2,link_url3,link_uri3,link_title3
,Relevant,thunderstorm,8/27/2015 15:57,iNWS Alert SPSGSP from 8/5/2015 10:40 PM to 11:15 PM EDT for Pickens County: STRONG THUNDERSTORM WILL IMPACT... http://t.co/LdcwKyuaFf,27777571,1,6.29E+17,FALSE,5,"Asheville, NC",778254445,finalized,1,https://www.facebook.com/permalink.php?story_fbid=930009590390462&id=265975640127197,https://www.facebook.com/,‪iNWS Alert SPSGSP from 8/5/2015 10:40 PM... - Jason Boyer WLOS | פייסבוק‬,,,,,,
,Relevant,thunderstorm,8/31/2015 4:37,RT @LivingSafely: #NWS issues Severe #Thunderstorm Warnings for parts of #AR #NC #OK. Expect more trauma cases: http://t.co/FWqfCKNCQW,262389713,1,6.29E+17,FALSE,5,Worldwide,778254446,finalized,1,,,,,,,,,
,Relevant,thunderstorm,8/28/2015 9:36,Severe Thunderstorm Warnings have been cancelled in central Oklahoma. Still expect 50 mph winds penny sized hail,26079308,1,6.29E+17,FALSE,5,"Oklahoma City, OK",778254447,finalized,1,,,,,,,,,
,Relevant,thunderstorm,8/28/2015 4:21,RT @LivingSafely: NWS posts Severe #Thunderstorm Warnings for parts of #AR #NC #OK. Seek strong shelter if at risk: http://t.co/kImr0l24Fb,3115709498,1,6.29E+17,FALSE,5,,778254449,finalized,1,,,,,,,,,
,Relevant,thunderstorm,8/28/2015 9:40,GSP issues STRONG THUNDERSTORM WILL IMPACT PORTIONS OF NORTHEASTERN PICKENS COUNTY UNTIL 1115 PM EDT for  Greater Pickens Pickens Mountain‰_,1586980514,1,6.29E+17,FALSE,5,"Florence, South Carolina",778254451,finalized,1,,,,,,,,,
,Relevant,thunderstorm,8/28/2015 5:35,Severe Weather Statement issued August 05 at 9:33PM CDT by NWS: ...THE SEVERE THUNDERSTORM WARN... http://t.co/1EOf1Wxnpj #Skywarn #OKwx,129804504,1,6.29E+17,FALSE,5,73101,778254452,finalized,1,https://alerts.weather.gov/cap/wwacapget.php?x=OK1253B9A28C84.SevereWeatherStatement.1253B9A29008OK.OUNSVSOUN.a7672657f06ac96957212f31782173f1&utm_source=twitterfeed&utm_medium=twitter,https://alerts.weather.gov/,,,,,,,
,Relevant,thunderstorm,8/30/2015 18:33,OUN issues Severe Thunderstorm Warning for Oklahoma [OK] till 10:30 PM CDT http://t.co/do6H2pVuB4,34930325,1,6.29E+17,FALSE,5,,778254453,finalized,1,http://mesonet.agron.iastate.edu/vtec/#2015-O-NEW-KOUN-SV-W-0581,http://mesonet.agron.iastate.edu/,IEM :: Valid Time Extent Code (VTEC) App,,,,,,
,Relevant,thunderstorm,8/28/2015 9:32,Severe Thunderstorm Warning including Russellville AR Clarksville AR Dardanelle AR until 10:15 PM CDT http://t.co/n844h1ASPj,3045427302,1,6.29E+17,FALSE,5,,778254454,finalized,1,https://twitter.com/NWSSevereTstorm/status/629117693816258560/photo/1,https://twitter.com/,"NWS Severe Tstorm on Twitter: ""Severe Thunderstorm Warning including Russellville AR, Clarksville AR, Dardanelle AR until 10:15 PM CDT http://t.co/2l1iLU2neI""",,,,,,
,Relevant,thunderstorm,8/28/2015 11:26,Special Weather Statement issued August 05 at 10:40PM EDT by NWS: ...STRONG THUNDERSTORM WILL IMPACT PORTIONS ... http://t.co/ulqeR1yTpX,146021640,1,6.29E+17,FALSE,5,,778254455,finalized,1,https://alerts.weather.gov/cap/wwacapget.php?x=SC1253B9A28F40.SpecialWeatherStatement.1253B9A2AC8CSC.GSPSPSGSP.6dbefac0287c37921196fd32af26de1c&utm_source=twitterfeed&utm_medium=twitter,https://alerts.weather.gov/,,,,,,,
,Relevant,thunderstorm,8/29/2015 12:46,RT @LivingSafely: NWS posts Severe #Thunderstorm Warnings for parts of #AR #NC #OK. Seek strong shelter if at risk: http://t.co/kEa5l3b1AE,465348970,1,6.29E+17,FALSE,5,,778254456,finalized,1,http://forecast.weather.gov/wwamap/wwatxtget.php?cwa=usa&wwa=Severe%20Thunderstorm%20Warning,http://forecast.weather.gov/,National Weather Service Watch Warning Advisory Summary,,,,,,
,Relevant,thunderstorm,8/29/2015 10:11,Severe Thunderstorm Warning for Oklahoma County until 10:30pm. http://t.co/RsdkWZRc8g #okwx,15896162,1,6.29E+17,FALSE,5,Oklahoma City,778254457,finalized,1,http://www.news9.com/weather,http://www.news9.com/,"Oklahoma weather forecast, current conditions, watches & warning - News9.com - Oklahoma City, OK - News, Weather, Video and Sports | ",,,,,,
,Relevant,thunderstorm,8/28/2015 20:40,Strong Thunderstorm 4 Miles East of Pickens Moving NE At 20 MPH. Pea Size Hail and Wind Gusts Up to 40 MPH... #scwx http://t.co/TsaLetFtkt,318891155,1,6.29E+17,FALSE,5,South Carolina,778254460,finalized,1,http://www.simpleweatheralert.com/cgi-bin/weatherdetail.py?l=SC1253B9A28F40.SpecialWeatherStatement.1253B9A2AC8CSC.GSPSPSGSP.6dbefac0287c37921196fd32af26de1c&a=045&t=0,http://www.simpleweatheralert.com/,"
 
 - Simple Weather Alert",,,,,,
,Relevant,thunderstorm,9/1/2015 13:36,Severe Thunderstorm Warning for Oklahoma County in OK until 10:30pm CDT. #okwx,1105075398,1,6.29E+17,FALSE,5,"Tornado Alley, USA ",778254461,finalized,1,,,,,,,,,
,Relevant,thunderstorm,8/29/2015 10:12,OUN continues Severe Thunderstorm Warning for Oklahoma [OK] till 10:30 PM CDT http://t.co/oIM6Po8XCu,34930325,1,6.29E+17,FALSE,5,,778254462,finalized,1,http://mesonet.agron.iastate.edu/vtec/#2015-O-CON-KOUN-SV-W-0581,http://mesonet.agron.iastate.edu/,IEM :: Valid Time Extent Code (VTEC) App,,,,,,
,Relevant,thunderstorm,8/27/2015 22:11,Severe Thunderstorm Warning including Midwest City OK Del City OK Choctaw OK until 10:30 PM CDT http://t.co/ogxSY4GWD1,2544250500,1,6.29E+17,FALSE,5,"Nicoma Park, OK",778254463,finalized,1,https://twitter.com/NWSSevereTstorm/status/629122324738895872/photo/1,https://twitter.com/,"NWS Severe Tstorm on Twitter: ""Severe Thunderstorm Warning including Midwest City OK, Del City OK, Choctaw OK until 10:30 PM CDT http://t.co/ogxSY4GWD1""",,,,,,
,Relevant,thunderstorm,8/28/2015 3:28,Severe Thunderstorm pictures from across the Mid-South http://t.co/UZWLgJQzNS,20552696,1,6.29E+17,FALSE,5,"Memphis, TN",778254464,finalized,1,http://wreg.com/2015/08/05/severe-thunderstorm-pictures-from-across-the-mid-south/,http://wreg.com/,Wednesday storm photos from across the Mid-South | WREG.com,,,,,,
,Relevant,thunderstorm,8/29/2015 10:36,RT @LivingSafely: NWS posts Severe #Thunderstorm Warnings for parts of #AR #NC #OK. Seek strong shelter if at risk: http://t.co/HE4Qh2I5wF,79506638,1,6.29E+17,FALSE,5,Worldwide,778254465,finalized,1,http://forecast.weather.gov/wwamap/wwatxtget.php?cwa=usa&wwa=Severe%20Thunderstorm%20Warning,http://forecast.weather.gov/,National Weather Service Watch Warning Advisory Summary,,,,,,
,Relevant,thunderstorm,9/1/2015 16:03,Severe Thunderstorm Warnings have been cancelled in central Oklahoma. Still expect 50 mph winds penny sized hail,193866394,1,6.29E+17,FALSE,5,"Oklahoma City, OK",778254466,finalized,1,,,,,,,,,
,Relevant,thunderstorm,8/29/2015 14:46,Pretty bad ass thunderstorm,327446916,1,6.29E+17,FALSE,5,336,778254467,finalized,0,,,,,,,,,
,Relevant,thunderstorm,8/28/2015 3:16,[HIGH PRIORITY] SEVERE THUNDERSTORM WATCH ENDED Issued for Lethbridge [Updated: Aug 05th 20:29 MDT] http://t.co/yqYiwjN8eZ,22256913,1,6.29E+17,FALSE,5,"Lethbridge, Alberta, Canada",778254468,finalized,1,http://weather.gc.ca/warnings/report_e.html?ab7,http://weather.gc.ca/,Alerts for: Lethbridge - Taber - Milk River - Environment Canada,,,,,,
,Relevant,thunderstorm,9/1/2015 16:20,A STRONG THUNDERSTORM WILL AFFECT CENTRAL HALIFAX COUNTY THROUGH 1145 PM EDT for Halifax [VA] till 11:45 PM EDT http://t.co/MjSTefgGU5,34924191,1,6.29E+17,FALSE,5,,778254469,finalized,1,http://mesonet.agron.iastate.edu/wx/afos/p.php?pil=SPSRNK&e=201508060242,http://mesonet.agron.iastate.edu/,IEM :: SPS from NWS RNK,,,,,,
,Relevant,thunderstorm,8/27/2015 15:23,NWS has issued a Severe Thunderstorm Warning for Oklahoma-OK until 10:30 PM,2305296439,1,6.29E+17,FALSE,6,"El Dorado, Arkansas",778254473,finalized,1,,,,,,,,,
,Relevant,thunderstorm,8/31/2015 4:49,#usNWSgov Severe Weather Statement issued August 05 at 10:38PM EDT by NWS: ...THE SEVERE THUNDERSTORM WARNING ... http://t.co/7HuEN4rWrn,17080018,1,6.29E+17,FALSE,5,,778254475,finalized,1,https://alerts.weather.gov/cap/wwacapget.php?x=NC1253B9A28E78.SevereWeatherStatement.1253B9A291FCNC.RAHSVSRAH.8927c730971635ad211fd98a58ed643a,https://alerts.weather.gov/,,,,,,,
,Relevant,tornado,8/31/2015 16:43,Storm damage maybe a tornado near Chadbourn. See http://t.co/gAs4sS3dKS http://t.co/zlhVYArtCU,113448762,1,6.29E+17,FALSE,5,"ּֿT: 35.353272,-78.553744",778254480,finalized,1,https://www.tabor-loris.com/2015/08/05/storm-damage-maybe-a-tornado-at-chadbourn/,https://www.tabor-loris.com/,"Storm damage, maybe a tornado, at Chadbourn – Tabor-Loris Tribune",https://twitter.com/tribdeuce/status/629106500766703616/photo/1,https://twitter.com/,"Deuce Niven on Twitter: ""Storm damage, maybe a tornado near Chadbourn. See http://t.co/gAs4sS3dKS http://t.co/zlhVYArtCU""",,,
,Relevant,tornado,9/1/2015 13:41,Second tornado confirmed in Sunday‰×s storm http://t.co/Ffnzit7kgN,2846113193,1,6.29E+17,FALSE,5,Canada,778254488,finalized,1,,,,,,,,,
,Relevant,tornado,8/27/2015 15:50,(OK)  Severe Thunderstorm Warning issued August 05 at 8:29PM CDT until August 05 at 9:15PM CDT by NWS http://t.co/O8X4M5eR6b #okwx,825252882,1,6.29E+17,FALSE,7,Midwest,778254491,finalized,1,https://alerts.weather.gov/cap/wwacapget.php?x=OK1253B9A263E4.SevereThunderstormWarning.1253B9A2857COK.OUNSVROUN.ae4961a080130db722b347a1b8d96c9c&utm_source=dlvr.it&utm_medium=twitter,https://alerts.weather.gov/,,,,,,,
,Relevant,tornado,9/1/2015 2:31,@SakhalinTribune Calgary area tornado warnings end as thunderstorms move eastward,930938994,1,6.29E+17,FALSE,5,"Fort Knox, KY 40121",778254493,finalized,1,,,,,,,,,
,Relevant,tornado,8/28/2015 11:40,http://t.co/Dg0EcBYKJL Tornado warnings end after thunderstorms hammer Calgary region for 2nd night #HeadlinesApp,1278717012,1,6.29E+17,FALSE,5,,778254494,finalized,1,,,,,,,,,
,Relevant,tornado,8/29/2015 1:27,(AL)  Severe Thunderstorm Warning issued August 05 at 8:44PM CDT until August 05 at 9:15PM CDT by NWS http://t.co/bviYy8BMsb #alwx,825252882,1,6.29E+17,FALSE,5,Midwest,778254495,finalized,1,https://alerts.weather.gov/cap/wwacapget.php?x=AL1253B9A269C0.SevereThunderstormWarning.1253B9A2857CAL.HUNSVRHUN.297b7297cb64a93cd0dc493f25289ceb&utm_source=dlvr.it&utm_medium=twitter,https://alerts.weather.gov/,,,,,,,
,Relevant,tornado,8/27/2015 16:16,Environment Canada confirms 2nd tornado touched down last weekend וָ http://t.co/x8zqbwNfO1,2882200121,1,6.29E+17,FALSE,6,Toronto,778254499,finalized,1,,,,,,,,,
,Relevant,tornado,8/27/2015 22:13,Tornado warnings issued for southern Alberta http://t.co/zqmzAi8yIz,2846113193,1,6.29E+17,FALSE,5,Canada,778254500,finalized,1,,,,,,,,,
,Relevant,tornado,8/28/2015 12:46,Pizza and beer in a tornado in Austin. Windy af right now,125808078,1,6.29E+17,FALSE,5,"San Antonio, TX",778254501,finalized,0,,,,,,,,,
,Relevant,tornado,8/27/2015 13:51,Still can't get over the thunderstorm/tornado we were woken up to yesterday. Half the street is still in the dark! http://t.co/Y8h5v1j2y7,839877715,1,6.29E+17,FALSE,5,Providence RI / Lisnaskea ,778254502,finalized,0,https://twitter.com/CiaraReilly5?protected_redirect=true,https://twitter.com/,Tweets with replies by Ciara Willett (@CiaraReilly5) | Twitter,,,,,,
,Relevant,tornado,8/30/2015 10:43,@Rebelmage2 I'm glad you got away XD But My 'be safe' was in reference to a tornado near calgary and drum heller at around 4 :O,2465115373,1,6.29E+17,FALSE,5,,778254508,finalized,0,,,,,,,,,
,Relevant,tornado,9/2/2015 1:15,Calgary area tornado warnings end as thunderstorms move eastward - CBC.ca: CBC.ca Calgary area tornado warnings end‰_ http://t.co/ST9jPZ8Y24,437058481,1,6.29E+17,FALSE,5,canada,778254517,finalized,1,,,,,,,,,
,Relevant,tornado,8/28/2015 7:32,Illinois Tornado Slipped Under The Radar Emergency Officials Say http://t.co/P4KOfYtkdx,2693126209,1,6.29E+17,FALSE,5,Naperville,778254520,finalized,1,http://www.govtech.com/em/disaster/Illinois-Tornado-Slipped-Under-The-Radar-Emergency-Officials-Say.html,http://www.govtech.com/,"Illinois Tornado Slipped Under the Radar, Emergency Officials Say",,,,,,
,Relevant,tornado,9/1/2015 16:37,Maybe that's what happens when a tornado meets a volcano,465808235,1,6.29E+17,FALSE,5,  ,778254521,finalized,0,,,,,,,,,
,Relevant,tragedy,8/27/2015 14:51,Rly tragedy in MP: Some live to recount horror: ‰ֿWhen I saw coaches of my train plunging into water I called ... http://t.co/72ix7vM87w,69549149,1,6.29E+17,FALSE,5,,778254534,finalized,1,,,,,,,,,
,Relevant,tragedy,8/29/2015 18:29,Rly tragedy in MP: Some live to recount horror: ‰ֿWhen I saw coaches of my train plunging into water I called ... http://t.co/Calk5nv5Vc,1714704836,1,6.29E+17,FALSE,5,,778254536,finalized,1,,,,,,,,,
,Relevant,tragedy,8/29/2015 10:37,'1 Death is a tragedy; a million Deaths is a statistic.' Stalin August 6 1945 U.S. Atomic Bomb Dropped On... http://t.co/kaMPx4eOS9,484270244,1,6.29E+17,FALSE,5,http://www.amazon.com/dp/B00HR,778254539,finalized,1,https://twitter.com/wisedadlives,https://twitter.com/,Devin Norwood (@wisedadlives) | Twitter,,,,,,
,Relevant,tragedy,9/2/2015 1:37,Railways caught unawares by MP tragedy; Accident spot never marked as ‰קvulnerable‰× http://t.co/UB1JZskmRc,29958928,1,6.29E+17,FALSE,5,,778254546,finalized,1,,,,,,,,,
,Relevant,tragedy,8/28/2015 9:32,"@TOIIndiaNews ofcourse 

Just 8 minute b4 tragedy another train had crossed this place 

N a flash flood caued washing of tracks..",2205832156,1,6.29E+17,FALSE,5,dubai ,778254547,finalized,0,,,,,,,,,
,Relevant,tragedy,8/27/2015 15:50,#ModiMinistry Rly tragedy in MP: Some live to recount horror http://t.co/s43wE7Oe2i,2425268995,1,6.29E+17,FALSE,7,,778254548,finalized,1,http://timesofindia.indiatimes.com/india/Some-lived-to-recount-the-horror-but-some-families-just-vanished/articleshow/48368699.cms,http://timesofindia.indiatimes.com/,"Some lived to recount the horror, but some families just vanished | India News - Times of India
			",,,,,,
,Relevant,tragedy,9/1/2015 19:29,DTN India: Rly tragedy in MP: Some live to recount horror: ‰ֿWhen I saw coaches of my train plunging into water... http://t.co/WK63tm34a0,140162053,1,6.29E+17,FALSE,5,Canada,778254552,finalized,1,,,,,,,,,
,Relevant,tragedy,8/27/2015 15:54,Rly tragedy in MP: Some live to recount horror: ‰ֿWhen I saw coaches of my train plunging into water I called ... http://t.co/0Xh758OnUP,3191610265,1,6.29E+17,FALSE,6,,778254557,finalized,1,,,,,,,,,
,Relevant,tragedy,9/1/2015 16:32,Rly tragedy in MP: Some live to recount horror: ‰ֿWhen I saw coaches of my train plunging into water I called ... http://t.co/CaR5QEUVHH,507417278,1,6.29E+17,FALSE,5,,778254562,finalized,1,,,,,,,,,
,Relevant,tragedy,8/27/2015 18:10,Rly tragedy in MP: Some live to recount horror: ‰ֿWhen I saw coaches of my train plunging into water I called ... http://t.co/cSPAmWTo6T,35439927,1,6.29E+17,FALSE,5,Namma Bengaluru,778254565,finalized,1,,,,,,,,,
,Relevant,tragedy,8/27/2015 17:44,Rly tragedy in MP: Some live to recount horror: ‰ֿWhen I saw coaches of my train plunging into water I called my daughters and said t...,329695511,1,6.29E+17,FALSE,5,India,778254568,finalized,1,,,,,,,,,
,Relevant,trapped,8/29/2015 1:50,@LauraE303B @SheilaGunnReid A war we'll never win? There r 2500 Yezidi women trapped as slaves.We know where they are. Doing nothing is evil,273456262,1,6.29E+17,FALSE,5,,778254576,finalized,0,,,,,,,,,
,Relevant,trapped,8/29/2015 12:04,Bomb head? Explosive decisions dat produced more dead children than dead bodies trapped tween buildings on that day in September there,331649297,1,6.29E+17,FALSE,5,10 Steps Ahead.  Cloud 9,778254583,finalized,0,,,,,,,,,
,Relevant,trapped,8/28/2015 20:37,Hollywood Movie About Trapped Miners Released in Chile: 'The 33' Hollywood movie about trapped min... http://t.co/BinNJwobtU #topstories,336041336,1,6.29E+17,FALSE,5,USA,778254607,finalized,1,http://abcnews.go.com/Entertainment,http://abcnews.go.com/,"Entertainment News |Latest Celebrity News, Videos & Photos - ABC News - ABC News",,,,,,
,Relevant,trapped,8/29/2015 12:06,Hollywood Movie About Trapped Miners Released in Chile: 'The 33' Hollywood movie about trapped miners starring... http://t.co/0f8XA4Ih1U,413022300,1,6.29E+17,FALSE,5,,778254615,finalized,1,http://abcnews.go.com/Entertainment,http://abcnews.go.com/,"Entertainment News |Latest Celebrity News, Videos & Photos - ABC News - ABC News",,,,,,
,Relevant,trauma,8/28/2015 7:22,#NissanNews : Trauma Alert and 1 Child Among 6 Hospitalized After 2-Car Wreck on A1A Near Bing's Landing: The ... http://t.co/9dWyJqvFY4,2600199092,1,6.29E+17,FALSE,5,"Detroit, MI",778254631,finalized,1,https://www.google.com/url?rct=j&sa=t&url=http://flaglerlive.com/82115/a1a-hammock-wreck/&ct=ga&cd=CAIyGmIzOWIwMGUwMTQ4NTQwOWE6Y29tOmVuOlVT&usg=AFQjCNGWdjRyiVZRIt4KolVW3JFCcySZXg&utm_source=twitterfeed&utm_medium=twitter,https://www.google.com/,,,,,,,
,Relevant,trauma,8/27/2015 13:46,Hiroshima: They told me to paint my story: Eighty-nine year old man recalls the terror and the trauma when the... http://t.co/VhMbN4bn0b,3096513815,1,6.29E+17,FALSE,6,,778254657,finalized,1,http://www.aljazeera.com/blogs/editors-blog/2015/08/hiroshima-japan-atomic-bomb-painter-keigo-miyagawa-150805155310433.html?utm_source=Reliable+Source&utm_medium=twitter,http://www.aljazeera.com/,Hiroshima: They told me to paint my story - Al Jazeera English,,,,,,
,Relevant,traumatised,8/29/2015 19:59,"@PeterDutton_MP 
YOU DIDN'T 'STARE' DOWN 'PPL SMUGGLERS' 
YOU PAID THEM TO GO AWAY!
2 men died many traumatised children abused. #auspol",337688338,1,6.29E+17,FALSE,5,Time for NON VIOLENT dissent! ,778254694,finalized,1,,,,,,,,,
,Relevant,traumatised,8/28/2015 19:42,@michellemccann we had that last night - lightning for 2 hours! Poor Dawg traumatised. Ended up huddling in basement. @David_Williamso,61064326,1,6.29E+17,FALSE,5,"Halifax, Nova Scotia, Canada",778254700,finalized,0,,,,,,,,,
,Relevant,trouble,9/1/2015 16:20,@canagal Good to hear it's back.. that storm's been given you guys trouble though :( ^SJ,216808077,1,6.29E+17,FALSE,5,Canada,778254734,finalized,0,,,,,,,,,
,Relevant,tsunami,8/31/2015 17:14,When tsunami says your order will take 40 minutes and you placed your order when you were on your way ????,160706954,1,6.29E+17,FALSE,5,,778254793,finalized,1,,,,,,,,,
,Relevant,tsunami,9/2/2015 6:44,Earthquake and tsunami that occurred in Japan 'free speech' is also swallowed. http://t.co/TJyyFT6NV0,299365948,1,6.29E+17,FALSE,5,??????????????,778254796,finalized,1,http://ameblo.jp/lancelot-zero/entry-10894238394.html,http://ameblo.jp/,,,,,,,
,Relevant,tsunami,8/28/2015 7:11,"?#FUKUSHIMA?#TEPCO?
Mountains of debris from the Japanese tsunami have floated to the West Coast
http://t.co/y518jYrZav",1001929386,1,6.29E+17,FALSE,5,The Netherlands,778254803,finalized,1,http://www.scoop.it/t/fukushima-by-ton-kraanen/p/4049006391/2015/08/06/mountains-of-debris-from-the-japanese-tsunami-have-floated-to-the-west-coast,http://www.scoop.it/,Mountains of debris from the Japanese tsunami h...,,,,,,
,Relevant,tsunami,8/28/2015 7:37,I hope this tsunami clears b4 i have to walk outside to my car ????,1007882112,1,6.29E+17,FALSE,5,but i love kaylen ??,778254807,finalized,0,,,,,,,,,
,Relevant,tsunami,8/29/2015 20:49,This high-tech sphere can be the key to saving lives during a tsunami. What would you pack in it? http://t.co/KwlpFqRBVp,1703422970,1,6.29E+17,FALSE,5,,778254817,finalized,0,http://www.techtimes.com/articles/65709/20150702/metal-capsule-key-tsunami-survival.htm,http://www.techtimes.com/,A Metal Capsule Might Be Key To Tsunami Survival : FUTURE TECH : Tech Times,,,,,,
,Relevant,twister,8/27/2015 20:59,Gail and Russell saw lots of hail at their Dalroy home - they have video of twister 1/2 mile from their home #yyc http://t.co/3VfKEdGrsO,1210320985,1,6.29E+17,FALSE,5,"Calgary, Alberta",778254827,finalized,1,https://twitter.com/news_ian/status/629094494411960320/photo/1,https://twitter.com/,"Ian Campbell on Twitter: ""Gail and Russell saw lots of hail at their Dalroy home - they have video of twister 1/2 mile from their home #yyc http://t.co/3VfKEdGrsO""",,,,,,
,Relevant,twister,9/1/2015 17:40,Tornadoes: El Nino may give Canada's twister season a boost #Toronto http://t.co/agyCutKBnN,3304195534,1,6.29E+17,FALSE,5,,778254858,finalized,1,http://webogi.com/xFsgKS,http://webogi.com/,,,,,,,
,Relevant,typhoon,8/30/2015 21:44,#Breaking144 Obama Declares Disaster for Typhoon-Devastated Saipan: Obama signs disaster declarat... http://t.co/M8CIKs60BX #AceNewsDesk,3341950631,1,6.29E+17,FALSE,5,,778254876,finalized,1,http://abcnews.go.com/International,http://abcnews.go.com/,"International News | Latest World News, Videos & Photos -ABC News  - ABC News",,,,,,
,Relevant,typhoon,9/1/2015 22:32,Map: Typhoon Soudelor's predicted path as it approaches Taiwan; expected to make landfall over southern China by S‰_ http://t.co/JDVSGVhlIs,27404671,1,6.29E+17,FALSE,5,Savage States of America,778254877,finalized,1,,,,,,,,,
,Relevant,typhoon,8/27/2015 18:59,Find out how your fund was used for Typhoon Haiyan in the Philippines. See @DevPeace Haiyan Relief Funds Report http://t.co/JwxrX1LsqO,254240108,1,6.29E+17,FALSE,5,"Calgary, AB, Canada",778254878,finalized,1,http://calgarydiocese.ca/news-a-events/30-social-justice/1327-typhoon-haiyan-relief-funds-report.html?utm_content=bufferbc22a&utm_medium=social&utm_source=twitter.com&utm_campaign=buffer,http://calgarydiocese.ca/,,,,,,,
,Relevant,typhoon,8/28/2015 1:42,Global precipitation measurement satellite captures 3-D image of Typhoon Soudelor - NASAHurricane. Visit: http://t.co/sQN4girdvZ,87995697,1,6.29E+17,FALSE,5,Whole World ,778254879,finalized,1,http://techworld24.com/,http://techworld24.com/,Tech World24 - Best Tech Zone,,,,,,
,Relevant,typhoon,8/27/2015 14:54,Struggling to Return to Life: Makurazaki Typhoon on September 17 1945 killed thousands. http://t.co/fmp0JsH4wX http://t.co/X3TotYZAZe,72791338,1,6.29E+17,FALSE,5,"Bengaluru, India",778254880,finalized,1,http://www.pcf.city.hiroshima.jp/virtual/VirtualMuseum_e/exhibit_e/exh1202_e/exh120209_e.html,http://www.pcf.city.hiroshima.jp/,"Special Exhibition　Hiroshima, 1945 −A-bomb Damage Revealed in Photographs−/Struggling to Return to Life 2",https://twitter.com/pvaidyaraj/status/629353413730521089/photo/1,https://twitter.com/,"Prashanth ಪ್ರಶಾಂತ್ on Twitter: ""Struggling to Return to Life: Makurazaki Typhoon on September 17, 1945 killed thousands. http://t.co/fmp0JsH4wX http://t.co/X3TotYZAZe""",,,
,Relevant,typhoon,9/1/2015 13:44,Obama Declares Disaster for Typhoon-Devastated Saipan: Obama signs disaster declaration for Northern Marians a... http://t.co/Hni4v2ZUk3,3062711760,1,6.29E+17,FALSE,5,ID,778254881,finalized,1,http://abcnews.go.com/International,http://abcnews.go.com/,"International News | Latest World News, Videos & Photos -ABC News  - ABC News",,,,,,
,Relevant,typhoon,9/2/2015 6:22,Obama Declares Disaster for Typhoon-Devastated Saipan: Obama signs disaster declaration for Northern Marians a... http://t.co/UsVyHdG9OG,439423113,1,6.29E+17,FALSE,5,"Ibadan,Oyo state",778254882,finalized,1,http://abcnews.go.com/International,http://abcnews.go.com/,"International News | Latest World News, Videos & Photos -ABC News  - ABC News",,,,,,
,Relevant,typhoon,8/27/2015 16:09,#Map: Typhoon Soudelor's predicted path as it approaches Taiwan; expected to make landfall over southern China by ‰_ http://t.co/PgD7UXtVGg,435625148,1,6.29E+17,FALSE,6,Breaking News,778254883,finalized,1,,,,,,,,,
,Relevant,typhoon,8/28/2015 3:00,#breaking #news Global precipitation measurement satellite captures 3-D image of Typhoon Soudelor - @NASAHurricane http://t.co/20DNcthr4D,12896172,1,6.29E+17,FALSE,5,USA,778254884,finalized,1,https://www.nasa.gov/feature/goddard/2015/soudelor-northwestern-pacific-ocean/,https://www.nasa.gov/,NASA Analyzes Typhoon Soudelor's Rainfall | NASA,,,,,,
,Relevant,typhoon,9/2/2015 7:24,Obama Declares Disaster for Typhoon-Devastated Saipan: Obama signs disaster declaration for Northern Marians a... http://t.co/Q3DtOqO04c,77257561,1,6.29E+17,FALSE,5,ngapain?,778254885,finalized,1,http://abcnews.go.com/International,http://abcnews.go.com/,"International News | Latest World News, Videos & Photos -ABC News  - ABC News",,,,,,
,Relevant,typhoon,8/28/2015 12:47,Obama signs disaster declaration for Northern Marians after typhoon hits US territory  http://t.co/0IPaVKJgDC,2282124858,1,6.29E+17,FALSE,5,,778254886,finalized,1,https://www.youtube.com/watch?v=yG08hLEWzyM&1,https://www.youtube.com/,Solo Violin - Schizophrenia (female string) - YouTube,,,,,,
,Relevant,typhoon,9/1/2015 13:22,Obama Declares Disaster for Typhoon-Devastated Saipan: Obama signs disaster declaration for Northern Marians a... http://t.co/qjuU0wcWPx,338928425,1,6.29E+17,FALSE,5,"Tema,Accra",778254887,finalized,1,,,,,,,,,
,Relevant,typhoon,9/2/2015 1:17,abcnews - Obama Declares Disaster for Typhoon-Devastated Saipan: Obama signs disaster declaration for Northern... http://t.co/mg5eAJElul,146681424,1,6.29E+17,FALSE,5,,778254889,finalized,1,http://abcnews.go.com/International,http://abcnews.go.com/,"International News | Latest World News, Videos & Photos -ABC News  - ABC News",,,,,,
,Relevant,typhoon,8/29/2015 18:29,Typhoon Soudelor: When will it hit Taiwan ‰ׂ and how bad will it be? #GeneralNews http://t.co/cWZHgEzAJ4,1407956047,1,6.29E+17,FALSE,5,,778254890,finalized,1,,,,,,,,,
,Relevant,typhoon,8/27/2015 22:42,Obama Declares Disaster for Typhoon-Devastated Saipan: Obama signs disaster declaration for Northern Marians a... http://t.co/9i6CrCRq2m,385412955,1,6.29E+17,FALSE,5,,778254891,finalized,1,http://abcnews.go.com/International,http://abcnews.go.com/,"International News | Latest World News, Videos & Photos -ABC News  - ABC News",,,,,,
